<?xml version='1.0' encoding='utf-8'?>
<!-- DTD for a master database manipulation session. -->
<!ELEMENT Session (DDL_Statement*, DML_Statement*)>
<!ELEMENT DDL_Statement (#PCDATA)>
<!ELEMENT DML_Statement (#PCDATA)>
