<!DOCTYPE Session SYSTEM "dtd/script_file.dtd" >
<Session>
<!-- ===========================================================================
     Table with referential integrity at the next following level
==== ======================================================================= -->
   <DDL_Statement>DROP VIEW VHY_GRADUATE16 CASCADE;</DDL_Statement>
   <DDL_Statement>DROP VIEW VHY_GRADUATE15 CASCADE;</DDL_Statement>
   <DDL_Statement>DROP VIEW VHY_GRADUATE14 CASCADE;</DDL_Statement>
   <DDL_Statement>DROP VIEW VHY_GRADUATE13 CASCADE;</DDL_Statement>
   <DDL_Statement>DROP VIEW VHY_GRADUATE12 CASCADE;</DDL_Statement>
   <DDL_Statement>DROP VIEW VHY_GRADUATE11 CASCADE;</DDL_Statement>
   <DDL_Statement>DROP VIEW VHY_GRADUATE10 CASCADE;</DDL_Statement>
   <DDL_Statement>DROP VIEW VHY_GRADUATE09 CASCADE;</DDL_Statement>
   <DDL_Statement>DROP VIEW VHY_GRADUATE08 CASCADE;</DDL_Statement>
   <DDL_Statement>DROP VIEW VHY_GRADUATE07 CASCADE;</DDL_Statement>
   <DDL_Statement>DROP VIEW VHY_GRADUATE06 CASCADE;</DDL_Statement>
   <DDL_Statement>DROP VIEW VHY_GRADUATE05 CASCADE;</DDL_Statement>
   <DDL_Statement>DROP VIEW VHY_GRADUATE04 CASCADE;</DDL_Statement>
   <DDL_Statement>DROP VIEW VHY_GRADUATE03 CASCADE;</DDL_Statement>
   <DDL_Statement>DROP VIEW VHY_GRADUATE02 CASCADE;</DDL_Statement>
   <DDL_Statement>DROP VIEW VHY_GRADUATE01 CASCADE;</DDL_Statement>

   <DDL_Statement>DROP VIEW VHY_GRADUATE2 CASCADE;</DDL_Statement>
   <DDL_Statement>DROP VIEW VHY_GRADUATE1 CASCADE;</DDL_Statement>

   <DDL_Statement>DROP VIEW VHY_GRADUATE CASCADE;</DDL_Statement>

<!-- ===========================================================================
     Table with referential integrity at the next following level
==== ======================================================================= -->
   <DDL_Statement>DROP TABLE THY_ADVISES CASCADE;</DDL_Statement>

   <DDL_Statement>DROP TABLE THY_REGISTERED CASCADE;</DDL_Statement>

   <DDL_Statement>DROP TABLE THY_MAJOR CASCADE;</DDL_Statement>

   <DDL_Statement>DROP TABLE THY_TEACHES CASCADE;</DDL_Statement>

   <DDL_Statement>DROP TABLE THY_WORKSIN CASCADE;</DDL_Statement>

<!-- ===========================================================================
     Table with referential integrity at the next following level
==== ======================================================================= -->
   <DDL_Statement>DROP TABLE THY_COURSE CASCADE;</DDL_Statement>

   <DDL_Statement>DROP TABLE THY_DEPT CASCADE;</DDL_Statement>

   <DDL_Statement>DROP TABLE THY_EVALUATION CASCADE;</DDL_Statement>

   <DDL_Statement>DROP TABLE THY_PROF CASCADE;</DDL_Statement>

   <DDL_Statement>DROP TABLE THY_QUARTER CASCADE;</DDL_Statement>

</Session>

