<!DOCTYPE Session SYSTEM "dtd/script_file.dtd" >
<Session>
<!-- ===========================================================================
     Table with referential integrity at the next following level
==== ======================================================================= -->
   <DDL_Statement>DROP TABLE TMD_CALIBRATION_STATISTIC CASCADE;</DDL_Statement>

   <DDL_Statement>DROP TABLE TMD_TRIAL_RUN_PROTOCOL CASCADE;</DDL_Statement>

   <DDL_Statement>DROP TABLE TMD_TRIAL_RUN_ACTION CASCADE;</DDL_Statement>

   <DDL_Statement>DROP TABLE TMD_TRIAL_RUN CASCADE;</DDL_Statement>

<!-- ===========================================================================
     Table with referential integrity at the next following level
==== ======================================================================= -->
   <DDL_Statement>DROP TABLE TMD_CALIBRATION CASCADE;</DDL_Statement>

   <DDL_Statement>DROP TABLE TMD_TEST_TABLE_DDL CASCADE;</DDL_Statement>

   <DDL_Statement>DROP TABLE TMD_DATABASE_INSTANCE CASCADE;</DDL_Statement>

<!-- ===========================================================================
     Table with referential integrity at the next following level
==== ======================================================================= -->
   <DDL_Statement>DROP TABLE TMD_TEST_TABLE CASCADE;</DDL_Statement>

   <DDL_Statement>DROP TABLE TMD_TEST_SUITE_ACTION CASCADE;</DDL_Statement>

   <DDL_Statement>DROP TABLE TMD_TEST_QUERY_PAIR CASCADE;</DDL_Statement>

   <DDL_Statement>DROP TABLE TMD_PROCESSOR CASCADE;</DDL_Statement>

   <DDL_Statement>DROP TABLE TMD_OPERATING_SYSTEM CASCADE;</DDL_Statement>

   <DDL_Statement>DROP TABLE TMD_DATABASE_SYSTEM CASCADE;</DDL_Statement>

<!-- ===========================================================================
     Table without referential integrity
==== ======================================================================= -->
   <DDL_Statement>DROP TABLE TMD_VENDOR CASCADE;</DDL_Statement>

   <DDL_Statement>DROP TABLE TMD_TRIAL_RUN_STATUS CASCADE;</DDL_Statement>

   <DDL_Statement>DROP TABLE TMD_TEST_SUITE_OPERATION CASCADE;</DDL_Statement>

   <DDL_Statement>DROP TABLE TMD_TEST_SUITE CASCADE;</DDL_Statement>

   <DDL_Statement>DROP TABLE TMD_SQL_SYNTAX CASCADE;</DDL_Statement>

   <DDL_Statement>DROP TABLE TMD_PATTERN_SQL_IDIOM CASCADE;</DDL_Statement>

<!-- ===========================================================================
     Types
==== ======================================================================= -->
   <DDL_Statement>DROP TYPE CT_MD_READINGS;</DDL_Statement>

</Session>

